"","Datetime","Latitude","Longitude","Message"
"753",2012-10-31 18:49:36,46.2276,2.21375,"RT @amandapalmer: how to volunteer / donate to help victims of hurricane sandy via @gothamist: http://t.co/naZuG31g"
"754",2012-11-03 14:56:44,10000,10000,"R/T All North football players to meet behind John Deere on rt 37 west. The old hit dogs today @ 12 to unload supplies for hurricane relief."
"755",2012-11-02 21:07:46,10000,10000,"""RT @aleximelvin: @jenmorrisonlive Text \""""REDCROSS\"""" to 90999 to help with disaster relief from Hurricane Sandy!!! It will donate $10 from  ..."""
"756",2012-10-30 15:43:23,10000,10000,"RT @AHurricaneSandy: If you would like to donate to the red cross to help those affected by Hurricane Sandy, please do so at http://t.co ..."
"757",2012-10-30 17:20:16,10000,10000,"RT @AHurricaneSandy: If you're looking for ways to help those affected by Hurricane Sandy, please visit the Red Cross at http://t.co/dkg ..."
"758",2012-11-04 19:40:17,-38.4161,-63.6167,"""RT @Aeon_Stars: Make a difference...Please help those affected by Hurricane Sandy !!! Jon BonJovi  \""""Living'on a Prayer\""""  http://t.co/Qq7 ..."""
"759",2012-11-03 17:37:11,10000,10000,"RT @abigailreynolds: Buy a book and help hurricane relief efforts.  11 Austen-inspired authors donating royalties to charity @austenauth ..."
"760",2012-11-05 04:41:42,10000,10000,"RT @ABC: Participate in ABC's #DayofGiving Tomorrow to Help Hurricane Sandy Victims\http://t.co/pziI96vv"
"761",2012-11-07 18:37:12,10000,10000,"RT @ABC_Carpet: Help aid in #Sandy relief. We are accepting donations for those affected by the hurricane at 30 e 19th st. and at our Br ..."
"762",2012-11-03 22:59:11,10000,10000,"RT @abc7newsBayArea: Farmers markets throughout the Bay Area are collecting Red Cross donations to help victims of #Hurricane #Sandy: ht ..."
"763",2012-11-05 16:43:05,10000,10000,"RT @ABC30: Help spread the word about Day of Giving for Hurricane Sandy relief efforts. Call 1-800-HELP-NOW to donate, text ABC to 90999 ..."
"764",2012-11-02 13:00:28,10000,10000,"RT @AaronCohen777: How to Help Hurricane Sandy Victims http://t.co/Kq7JNRzT"
"765",2012-11-05 19:15:24,10000,10000,"RT @AAKnopf: Help provide new books to children affected by Hurricane #Sandy http://t.co/FtmUS4cK  (Thanks, @kimbarnesauthor)"
"766",2012-11-02 01:40:06,10000,10000,"RT @5PointzNYC: For any graffiti artists out there: We will be having an Art Show Benefit for the victims of Hurricane Sandy. Contact us ..."
"767",2012-11-05 21:00:47,39.0992,-84.5175,"RT @123organize Please share to help out Hurricane Sandy victims:) Opportunity to get organized & help Sandy victims! http://t.co/lhtbHr1z"
"768",2012-11-02 02:00:30,10000,10000,"RT @106KMEL: How YOU can help Hurricane Sandy victims!! CLICK HERE for more information! http://t.co/MQ2KKwht"
"769",2012-11-02 21:50:57,32.7549,-97.3303,"RT @1029NOW: Want to help the victims of Hurricane Sandy? Here's how: http://t.co/K6amWwHS"
"770",2012-11-02 17:27:16,41.7481,-74.0851,"Route 32 presents\Hurricane Sandy Relief Fund Benefit\Oasis Cafe Nov. 4th http://t.co/35rHwFj8"
"771",2012-11-06 02:18:05,8.3,-64.85,"@ROSHON My prayers go out to everyone affected by Hurricane Sandy. You can donate to the @RedCross via @iTunesMusic at http://t.co/J4R4jVyN"
"772",2012-11-05 15:46:20,10000,10000,"@ronblackswp My friend & I are collecting for Hurricane Sandy victims https://t.co/lnkz6pbG I msged via site regarding possible happy hour!"
"773",2012-10-31 04:06:26,12.9816,77.6085,"#Romney/Ryan collect donations for victims of #Sandy and ask for donations of blood to #RedCross #Frankenstorm #tcot http://t.co/5rUtbrhf"
"774",2012-11-04 23:51:59,39.9516,-75.1638,"""Romney: If you have \""""funds,\"""" donate to hurricane relief. If not, just ask your parents. #Mittstock"""
"775",2012-11-03 05:34:16,42.266,-89.0867,"Rockford First looking for donations for hurricane victims: Rockford First had just kicked off its 'Love Works'... http://t.co/o8wfr9vr"
"776",2012-11-05 15:43:02,22.5726,88.3639,"Robin Roberts Makes Special Plea On GMA To Help Victims Of Hurricane Sandy http://t.co/UHney4Im"
"777",2012-11-03 15:42:00,40.7561,-73.987,"ROBIN HOOD: LEARN HOW YOU CAN HELP HURRICANE RELIEF EFFORTS http://t.co/mU8CgMt6"
"778",2012-11-05 04:11:09,10000,10000,"@Revis24  Can I get RT to help spread the word for Hurricane Sandy Relief! Thanksgiving is almost here! https://t.co/5PaOGCiN"
"779",2012-11-03 23:59:06,40.8556,-76.2351,"Rescue Center bruised not broken and could use help after hurricane Sandy https://t.co/ignZZvvj http://t.co/cYnFz64D"
"780",2012-11-05 18:05:40,39.9516,-75.1638,"Reminder! Donate to the #NBC10 Hurricane #Sandy Relief Fund today until midnight! So many neighbors/friends need help. 877-NBC-WCAU"
"781",2012-11-04 01:07:05,33.7545,-84.3897,"Register & Run with a Passion to Support Hurricane Sandy Victims http://t.co/v7KPaHcr"
"782",2012-11-03 17:27:40,40.1586,-74.0703,"@RedSox please retweet! Text REDCROSS to 90999 to donate $10 for all that needs help from Hurricane Sandy #RedSoxNation"
"783",2012-11-01 20:34:40,10000,10000,"Redcross to 90999 or call 18007332767 to help out all of the people rocked by this hurricane"
"784",2012-11-03 00:52:53,40.7561,-73.987,"@RedCross please donate to the redcross for survivors of Hurricane Sandy, we love New York!"
"785",2012-10-30 15:46:58,36.7783,-119.418,"Red Cross is urging blood donations to support those affected by Hurricane Sandy. http://t.co/yRhuvh64"
"786",2012-10-30 22:57:12,35.1429,-90.0524,"Red Cross in need of platelet donors to aid hurricane victims: In an effort to assist victims of Hurric... http://t.co/Yz08h3Le #memphis"
"787",2012-11-02 19:06:05,34.0688,-118.445,"Red Cross hurricane support incl donations to specific zips and $10 when u text REDCROSS to 90999. http://t.co/wkfMPaY5"
"788",2012-11-07 16:34:24,37.7752,-122.419,"@RedCross HELP Red Cross Hurricane Sandy Relief Victims - Shop for a good cause!:) - http://t.co/Smhj1e4s"
"789",2012-11-01 09:19:53,10000,10000,"@reba $0.25 from each sale will go to the Red+ to help people affected by Hurricane Sandy Spread the word\http://t.co/B4Y2BhLF"
"790",2012-11-03 17:50:53,10000,10000,"Raising money for Hurricane Sandy relief. Help decide between 13x19 and 11x17 print. http://t.co/a0BgRsPO http://t.co/SsIMl5jj"
"791",2012-11-02 15:26:52,10000,10000,"PVM Clothing Drive\\So many people in our city were affected by Hurricane Sandy.\\Maybe you would like to get... http://t.co/PNS1eZps"
"792",2012-11-07 11:31:06,10000,10000,"Purchasing this book is a donation to Red Cross for the Hurricane victims. http://t.co/6Yzlpzws"
"793",2012-10-31 20:06:03,38.8921,-77.0241,"Pura Vida Bracelets Hurricane Sandy Relief: http://t.co/yjOgfDHv"
"794",2012-11-03 16:22:22,10000,10000,"Proceeds from @DeltaSigmaPhiLU #EgyptianExpedition go to the Red Cross! Help those affected by Hurricane Sandy! #donate #deltasig #KKG"
"795",2012-11-06 16:01:47,40.6955,-74.271,"Praying for our wonderful donors and volunteers today! We could not provide Hurricane Sandy relief without you! http://t.co/I7sQ4MTm"
"796",2012-11-03 00:09:43,32.9612,-96.9935,"""Pray for the east coast!! Estimated cost of Hurricane Sandy is $50 billion. text \""""REDCROSS\"""" to 90999 to donate $10!!!!!!!"""
"797",2012-11-01 01:12:47,35.9684,-85.8518,"Prayers to those devastated by the hurricane... please help by texting REDCROSS to 90999 to donate $10 to disaster relief #Sandy"
"798",2012-11-07 23:25:44,10000,10000,"@PoorLilItGirl please stop by donate coats, batteries, blankets, foood, phone cards for our Hurricane Sandy relief sunday 11.11 loca luna"
"799",2012-10-31 23:12:44,10000,10000,"PLZ RT and DONATE if you can, I am helping Hurricane Sandy Relief for family of 3  http://t.co/Szwrm3sN"
"800",2012-11-02 05:14:18,40.6752,-73.971,"Please visit this page to see how you may be able to help those hit the hardest by Hurricane Sandy: @ http://t.co/DMbIrtgL #IBOtoolbox"
"801",2012-11-03 00:23:24,43.1939,-71.5724,"Please tune to one of the many stations carrying the Hurricane Sandy relief concert and Donate #sandyaid"
"802",2012-11-03 04:17:03,40.7561,-73.987,"Please text REDCROSS to 90999 to help those who need it in the aftermath of Hurricane Sandy. I did it, which means you can definitely do it."
"803",2012-11-02 05:03:21,31.2448,-92.145,"Please text REDCROSS to 90999 to donate $10 to hurricane Sandy victims out East. These people really need it! #helpothersifyoucan"
"804",2012-11-03 00:40:31,10000,10000,"""Please text REDCROSS to 90999 to donate $10.00 to Hurricane #Sandy relief.  \""""It's not charity, it's humanity.\""""  Thank you"""
"805",2012-11-03 00:42:26,10000,10000,"Please text REDCROSS to 90999 for a $10 donation or call 1-800-435-7669 to make a donation to help Hurricane Sandy victims."
"806",2012-10-31 23:07:24,10000,10000,"Please text PREVENT to 25383 to donate $10 to the  @ASPCA's animal rescue efforts for animals who affected by  Hurricane Sandy #SandyPets"
"807",2012-11-04 20:21:28,10000,10000,"Please text KIDS to 80888 + donate $10 to help @CovenantHouse feed and shelter kids hurt by #Sandy in the hurricane region."
"808",2012-11-04 22:31:35,10000,10000,"Please text CONVOY to 50555! Help Hurricane Sandy Victims @Zendaya96"
"809",2012-11-03 03:30:31,35.2314,-80.8458,"Please text 90999 to make a $10 donation to The Red Cross to help the hurricane victims of NY and NJ and surrounding areas. Thank you!"
"810",2012-11-01 20:00:13,38.8921,-77.0241,"Please take a moment to read AAJ president @maryalicedallas<U+FF92> note on how you can help those affected by Hurricane Sandy http://t.co/ftROsFWu"
"811",2012-11-05 15:10:29,10000,10000,"Please support Hurricane #Sandy relief efforts by donating to @RedCross. Text REDCROSS to 90999 or click here: http://t.co/SUORDzXM \#Sandy"
"812",2012-11-05 19:26:14,10000,10000,"Please stop by the ARC and donate to the Hurricane Relief"
"813",2012-11-05 13:27:51,10000,10000,"Please show support for hurricane sandy victims and text the word redcross to 90999 #give all that you can #dayofgiving http://t.co/v8dZgIeg"
"814",2012-10-30 18:59:02,10000,10000,"""Please send an instant txt donation to help hurricane sandy victims. Text \""""REDCROSS\"""" to 90999 to make a $10 donation."""
"815",2012-11-03 03:53:58,40.7561,-73.987,"Please RT Volunteer Tomorrow, Hurricane Sandy Relief. Hit me up or just show up! http://t.co/7QtwOlME"
"816",2012-11-02 22:30:45,39.321,-111.094,"Please RT!-OPERATION MOBWIVES SAVING LIVES IS ACCEPTING DONATIONS 4 HURRICANE SANDY VICTIMS https://t.co/C4abdLu6 @CarolineManzo @Bethenny"
"817",2012-11-02 17:51:37,51.5002,-0.126236,"PLEASE RT......@L0uise: Help Hurricane Sandy https://t.co/iYvY4yfZ"
"818",2012-11-04 16:46:30,40.7561,-73.987,"Please RT! HURRICANE RELIEF REQUEST SHOW: 100% goes to #Sandy victims. TODAY 11/4 1:30-10pm EST. Watch/Submit lyrics on http://t.co/mVnYE9rv"
"819",2012-11-04 05:50:47,10000,10000,"****Please retweet this list of supplies needed for hurricane Sandy victims. http://t.co/WopPKaGp"
"820",2012-11-04 16:13:25,40.7561,-73.987,"Please Retweet: Long Island Hurricane Sandy Relief page http://t.co/KMBIdxb9 #longisland #SandyHelp"
"821",2012-11-05 12:01:31,10000,10000,"Please read how you can help the victims of Hurricane Sandy  =&gt; http://t.co/LbhxDJr4"
"822",2012-11-01 21:58:50,42.4072,-71.3824,"Please pray and especially do whatever you can to help those affected by hurricane Sandy, especially the hardest... http://t.co/IjF4ryRh"
"823",2012-11-03 01:11:03,40.7684,-74.1454,"Please, please, please text 90999 and the word REDCROSS to donate $10 to everyone affected by Hurricane Sandy."
"824",2012-11-04 13:25:06,41.2033,-77.1945,"Please keep this how to text $10 for Hurricane Sandy to the American Red Cross going!  Thank You!!  Gail http://t.co/Cn005UfI"
"825",2012-11-06 02:53:24,40.8884,-73.4154,"Please join with Gov. Chris Christie to help hurricane victims by supporting the New Jersey Relief Fund: http://t.co/C3aZrP4o"
"826",2012-11-01 10:51:59,33.7545,-84.3897,"Please, join us at JS Basketball. Donate $10 to the Redcross by texting to 90999 for the Hurricane Sandy victims"
"827",2012-11-02 03:56:23,10000,10000,"Please join me in donating to help the hurricane Sandy victims of Breezy Point:  https://t.co/o3gyFSNO via @WePay"
"828",2012-11-04 11:41:56,27.3382,-82.5269,"Please help with our Hurricane Sandy/Valpak relief effort ~ http://t.co/oMnBGmyk #sandyrelief #hope"
"829",2012-11-05 13:48:19,40.7561,-73.987,"Please help with Hurricane Sandy relief. One way is to donate to the American Red Cross. Many many people have... http://t.co/8ruewnUr"
"830",2012-11-03 00:35:15,40.7566,-73.9863,"Please help those people who were affected by the Hurricane Sandy visit http://t.co/lzgdG53s or 1-800-HELP-NOW 1-800-435-7669"
"831",2012-11-01 23:58:26,34.0522,-118.243,"Please help those in need affected by Hurricane Sandy:\http://t.co/6IE3Lw5t"
"832",2012-11-03 03:31:08,10000,10000,"Please help those affected by Hurricane Sandy!\Text to 90999 to make a $10 donation.\http://t.co/3T9fHKVy\1-800-435-7669\#SandyHelp"
"833",2012-11-03 03:09:24,36.7783,-119.418,"Please help those affected by Hurricane Sandy #giveback #SandyHelp"
"834",2012-11-03 00:04:15,10000,10000,"Please help those affected by Hurricane Sandy. Do everything you can. http://t.co/M5XaIYcu 1-800-435-7699 #SandyHelp"
"835",2012-11-04 23:44:07,10000,10000,"Please help the victims of Hurricane Sandy.Text REDCROSS to 90999 to donate $10 or call 1-800-help now (435-7669) Do what you can #SandyHelp"
"836",2012-11-03 00:13:49,42.8869,-78.8779,"Please help the victims of hurricane Sandy. #SandyHelp &lt;3 text REDCROSS to 90999 to donate $10!! Make a difference!"
"837",2012-10-31 04:48:21,10000,10000,"""Please help the @RedCross respond 2 those affected by Hurricane Sandy. http://t.co/npqchbVx or text \""""REDCROSS\"""" to 90999 to make a donation."""
"838",2012-10-30 16:54:49,41.6529,-83.5778,"Please help the Hurricane Sandy victims. #stvincentdepaul http://t.co/5qfDZ4Im"
"839",2012-10-31 02:25:29,43.1541,-77.6193,"Please help the animals affected by hurricane Sandy! Text ANIMALS to 20222 to donate $10 through the @HumaneSociety you can text up to 3x!"
"840",2012-11-03 15:15:27,31.9686,-99.9018,": Please help the American Red Cross help those in Hurricane Sandy's path: http://t.co/T5ysci8j know you ha... http://t.co/SxHLFo5R"
"841",2012-11-03 00:24:28,10000,10000,"Please help spread the word about the Red Cross and the work their doing to help those affected by Hurricane Sandy."
"842",2012-11-03 03:15:10,43.9527,-72.4262,"Please help out the victims of Hurricane Sandy by visiting http://t.co/Ch3ZZg8s and making a donation &lt;3 #HelpSandy"
"843",2012-11-06 03:34:17,43.0235,-83.6935,"Please help out hurricane Sandy were counting on you to make a change. Don't let these people die they need our help donate anything u can."
"844",2012-10-30 17:18:32,34.5018,-84.7098,"Please help our neighbors affected by Hurricane Sandy by supporting the Sandy relief efforts.  Donate to the... http://t.co/A9drZCw2"
"845",2012-11-03 03:58:38,49.2636,-123.139,"Please help! Make a #donation and help the people who have been effected by the #Hurricane. #SandyHelp http://t.co/grvcgAkW"
"846",2012-11-07 19:25:03,40.4108,-75.2479,"Please help Keller Williams help Hurricane Sandy victims... http://t.co/kXpE3NYw"
"847",2012-11-03 00:38:30,38.8318,-76.6114,"Please help hurricane sandy victims!!!"
"848",2012-11-03 00:53:29,40.7561,-73.987,"Please help hurricane #Sandy survivors. Visit http://t.co/l5IBOSTL http://t.co/jijWSx0D"
"849",2012-11-03 00:17:22,40.7561,-73.987,"Please go to iTunes & make a donation to the Red Cross to aid in Hurricane relief or text 90999 to give $10 #SandyHelp"
"850",2012-11-06 00:46:02,40.4872,-74.4399,"Please go to http://t.co/xHRyUA9H and buy one of their T's. 100% of funds go to hurricane relief unlike Red Cross w http://t.co/W6aucDG5"
"851",2012-11-03 02:37:42,42.8,-122.9,"Please give what you can. All funds will go to the UR Red Cross for Hurricane Sandy. http://t.co/GpPMUDvj"
"852",2012-11-02 16:57:51,40.7282,-73.7949,"Please follow this link to find out how you can help with the hurricane relief efforts. http://t.co/4c52QmkP"
"853",2012-11-03 00:23:13,10000,10000,"Please do what u can to make a donation for the people in Hurricane area #HelpSandy any amount u can txt RedCross 90999 or 1-800-HELP-NOW"
"854",2012-11-05 07:42:52,36.7783,-119.418,"Please donate to the Red Cross to help those who were victims to Hurricane Sandy. Many are without homes and power. http://t.co/hihOIFPg"
"855",2012-11-02 19:18:02,40.7747,-73.9821,"Please donate to the Red Cross to help people in need who have been hurt by Hurricane Sandy. #redcross #help #helpstatenisland"
"856",2012-11-02 23:58:56,10000,10000,"Please donate to the American Red Cross for the Disaster Relief of Hurricane Sandy Victims.---&gt; http://t.co/HzYqJewB"
"857",2012-10-31 04:40:36,33.7615,-117.925,"Please donate to Red Cross for Hurricane Relief! http://t.co/iAgR9XO6"
"858",2012-11-03 02:24:35,40.0583,-74.4057,"please donate to redcross 90999 to help victims of hurricane sandy ny/nj....they need your help! please donate"
"859",2012-11-03 00:07:33,10000,10000,"Please donate to hurricane sandy victims on your NBC station. Text Red Cross to 90999 or http://t.co/QDQra8Tn to don http://t.co/vTenE0PG"
"860",2012-11-03 03:55:07,40.0583,-74.4057,"Please Donate to Hurricane Sandy Victims! CLICK HERE to Donate Today! http://t.co/zQsjXCXQ\New Yorkers #SandyHelp Denzel Washington"
"861",2012-11-03 02:02:48,43.0402,-87.9145,"Please donate if you can to hurricane relief.  I chose to donate here... http://t.co/iGvMDEf7"
"862",2012-11-05 22:55:38,32.8415,-83.6492,"Please donate any monetary amount you can to @Redcross for the hurricane victims. Text REDCROSS to 90999. Please help now!"
"863",2012-11-03 01:52:37,41.6032,-73.0877,"Please donate $10 to Hurricane Relief text REDCROSS 90999 Thank You #SandyHELP"
"864",2012-11-05 01:57:25,38.8921,-77.0241,"Please donate $10 for Hurricane Sandy Victims. Text CONVOY to 50555 !!! #GoodActions People really need your help"
"865",2012-11-03 03:12:47,47.913,-122.099,"Please do anything you can do to help the devastation of Hurricane Sandy. Visit http://t.co/IIznVKcn or call 1-800-SANDY HELP #SandyHelp"
"866",2012-11-07 22:00:29,10000,10000,"Please do all you can to help the victims of Hurricane Sandy! Visit the American Red Cross today for more information. http://t.co/qpl9TGsK"
"867",2012-11-07 21:39:01,37.8393,-84.27,"Please consider joining in the hurricane relief efforts! http://t.co/BSHmV0hq"
"868",2012-11-05 00:31:42,49.2636,-123.139,"Please consider donating to the American Red Cross to help recovery efforts after the devastation of Hurricane Sandy: http://t.co/zbFfVSan"
"869",2012-11-03 16:41:03,40.7561,-73.987,"Please consider a donation to the @RedCross to help those affected by Hurricane Sandy. http://t.co/h9WbNM4d   Pass it on!"
"870",2012-11-03 13:53:08,10000,10000,"Please come out to the food drives at McCaffrey's Newtown and Yardley today from 10AM-4PM to help victims from the hurricane!!"
"871",2012-11-04 03:58:25,10000,10000,"Please be careful if you donate to help the people and animals affected by Hurricane Sandy! http://t.co/SO6wJkTO"
"872",2012-11-06 02:26:41,10000,10000,"Playing Dead Island with The GF Donate to the Red Cross for Hurricane Sandy Victims Link is below : http://t.co/GVXOuBrx"
"873",2012-11-03 03:35:21,25.7743,-80.1903,"Photo: (Made with @Tweegram App) Please text REDCROSS to 90999 to donate $10 to the hurricane relief effort.... http://t.co/gAHWyXGp"
"874",2012-11-03 13:47:03,41.4037,-73.4594,"#photography (feed) : Please help the American Red Cross help those in Hurricane Sandy's path: http:... http://t.co/Bc9zkbGd @RickSammon"
"875",2012-11-05 13:55:38,39.9516,-75.1638,"Philly! We'll be collecting supplies/clothes & non-perishable food items Mon & Tues at @ChatterBlast . Please help victims Hurricane #Sandy."
"876",2012-11-02 16:35:10,39.9516,-75.1638,"Philadelphia Union Official Site: How You Can Help Hurricane Sandy Victims: The American Red Cross is Supporting... http://t.co/5KzBdsxj"
"877",2012-11-04 17:36:22,40.7719,-73.9306,"@pfvjr Please RT donate 2 victims of Hurricane Sandy by shipping items to Occupy Sandy relief outpost Church in Bklyn http://t.co/WnDJXxoU"
"878",2012-11-02 19:11:54,41.0769,-85.134,"Pets in need of blood on East Coast: Hurricane Sandy has placed a demand for animal blood on states a... http://t.co/oRP06zqr #fortwayne"
"879",2012-11-03 01:46:11,42.3302,-83.0459,"People, Txt REDCROSS to 90999 to donate $10 to help the victims of hurricane #Sandy. Please RT to get the word out."
"880",2012-11-01 22:45:18,44.6462,-63.5736,"People affected by #Hurricane #Sandy need our help! Text REDCROSS to 90999 to donate $10. Or go to http://t.co/XPK9H7cy"
"881",2012-11-02 11:57:13,43.5009,-70.4428,"Patriot Subaru will match $5000 in donations to the Red Cross Hurricane Relief Fund.  Click here for details:... http://t.co/lKDmDprb"
"882",2012-11-05 23:47:33,40.6067,-74.1624,"Part of the proceeds to benefit the Red Cross in NY for the Hurricane Relief...please share... http://t.co/nWKj9VTZ"
"883",2012-11-01 00:15:07,39.7496,-105.216,"Page 1 Solutions Using Google+ to Help Victims of Hurricane Sandy. Read more to see how you can help: http://t.co/UEeA8c8l"
"884",2012-11-01 22:14:34,10000,10000,"#packThePit at 7pm in al Lawson! support #FAMUbasketball &bring clothes for hurricane sandy victims!"
"885",2012-11-05 13:32:20,-84.2807,30.4383,"@PacebookRunClub @am588 @procompression - all proceeds go to Hurricane Sandy relief efforts."
"886",2012-10-30 20:26:44,38.7904,-89.9794,"Our thoughts are with everyone dealing with Sandy's aftermath. RT @daniellelaporte: How To Help After Hurricane Sandy http://t.co/bm34vBtm"
"887",2012-10-30 17:21:54,32.5641,-117.044,"Our thoughts are with all those affected by Hurricane Sandy. Please donate to the Red Cross at their website: http://t.co/RGyl4dMF."
"888",2012-10-31 17:34:36,30.3651,-88.5486,"Our thoughts and prayers are with those affected by Hurricane Sandy. Here are some tips from the Red Cross on... http://t.co/GsCaATnF"
"889",2012-11-02 14:50:18,41.8795,-87.6243,"Our #kids #book series sales this week will send 30% to #RedCross for Hurricane #Sandy relief. #kidlit #parenting - http://t.co/zd8xpLxS"
"890",2012-11-01 13:50:47,10000,10000,"Our Hurricane Sandy Relief  phone bank with the Red Cross is underway. Please call 865-584-2999 to donate. #6News #RedCross #HurricaneRelief"
"891",2012-11-01 15:57:12,34.098,-118.327,"Our hearts go out to everyone impacted by Hurricane Sandy. Please text REDCROSS to 90999 to make a $10 donation to contribute."
"892",2012-11-01 18:45:18,42.3589,-71.0578,"Our friends @thredUP are collecting money for Hurricane #Sandy relief. Donate? Maybe send clothing for cash donations? http://t.co/eO6Mdwcx"
"893",2012-11-02 04:31:36,35.2314,-80.8458,"Our followers pull through! Keep those Hurricane Sandy relief orders coming! http://t.co/8Jv0JT9w"
"894",2012-11-03 20:51:29,39.9593,-74.1903,"Our area is in need of major help! The littlest things that you can do would be great. Please donate &lt;3 #jerseystrong #hurricane sandy"
"895",2012-11-04 22:40:06,10000,10000,"Other great ways to help NYC hurricane victims: http://t.co/ablqvtms  #Sandy #NYC #NewYork @occupysandy"
"896",2012-11-02 22:46:36,51.2538,-85.3232,"@OSH74 @BMTUND Support Hurricane Sandy relief efforts by buying a screensaver!  http://t.co/ka0pNFT5"
"897",2012-11-04 15:33:08,10000,10000,"Open @ 11 for brunch.1st Bloody Mary/ mimosa $3! Pancakes,Fr toast,stratta!100% of Sun proceeds go to hurricane relief! http://t.co/X33Afzdw"
"898",2012-11-05 12:58:40,41.6032,-73.0877,"On way to NYC for this on @KatieShow! <U+FF93>@ABC: Participate in ABC's #DayofGiving Today to Help Hurricane Sandy Victims\http://t.co/uPL9I5pL<U+FF94>"
"899",2012-11-03 01:11:14,40.7561,-73.987,"OK, done. Donated $10 by texting REDCROSS to 90999 to those affected by Hurricane Sandy. Who's next? #SandyHelp"
"900",2012-11-06 00:23:17,10000,10000,"@OfficialKimora pls RT: NY & NJ still need help! Buy hurricane Sandy Relief Shirt.100%Profits 2 Those Affected By Sandy http://t.co/1vq57ywi"
"901",2012-11-03 04:14:18,39.9473,-75.175,"@ochocinco Please support my friends from Long Beach Island, NJ by RTing. Visit http://t.co/Ga3mEgZd for Hurricane Relief T-shirts. Thanks!"
"902",2012-11-05 19:41:49,41.1634,-74.0562,"#OccupySandy using #Amazon Gift Registry to collect donations for victims of hurricane via @hreins http://t.co/4oYyKv1i"
"903",2012-11-05 18:57:39,40.7029,-74.3788,"Occupy Sandy!  More ways to help with the hurricane recovery: Occupy Sandy is a coordinated relief effort to help... http://t.co/6M8QKJIt"
"904",2012-11-02 21:04:31,-22.9035,-43.2096,"@ObamaNews\Blog Post: How to Help the Survivors of Hurricane Sandy Clean-up http://t.co/4XvwU5Xe http://t.co/RG9RVxdZ"
"905",2012-10-30 16:15:27,40.7144,-74.006,"Obama campaign e-mails about Hurricane Sandy, urges Red Cross donations."
"906",2012-11-05 18:10:45,40.7561,-73.987,"Nyc look in your closet and donate any clothing you can spare to your local church to help victims of hurricane sandy #charity"
"907",2012-11-03 00:04:56,10000,10000,"#NW Hurricane Sandy: Coming Together benefit #SandyHelp http://t.co/38Pcy4CJ or call 1-800-HELP-NOW, or text REDCROSS to 90999 to donate $10"
"908",2012-11-03 00:33:28,42.934,-78.8804,"""@NPCTEXAS: #SandyHelp Text \""""Red Cross\"""" to 909-99 to donate $10 to hurricane victims. And put on NBC now.&gt; yes!!"""
"909",2012-10-31 18:02:51,42.4606,-83.1346,"Now would be a good time to consider donating money and resources to help those displaced by the hurricane. Help if you can."
