"","Datetime","Latitude","Longitude","Message"
"2342",2012-10-29 15:40:07,10000,10000,"Looking for tags for #sandy ? Check out http://t.co/akOsCeOG and see hash tags in a geographic format!!  #Northeast #hurricane"
"2343",2012-10-31 22:36:44,29.9655,30.9197,"Looking for those who would like to perform at a beneift concert for hurricane sandy survivors. Donations will be sent 2 a shelter in NY"
"2344",2012-11-04 18:05:09,35.9132,-79.0558,"Looks like Granville borrowed some Hurricane Sandy relief for our sprinkler disaster."
"2345",2012-10-31 01:30:59,10000,10000,"Looks like Hurricane Sandy visited my room...... #needtoclean"
"2346",2012-11-02 09:15:16,10000,10000,"??Lord, please help the Hurricane Sandy victims. Give them peace, a safe refuge and hope. ??"
"2347",2012-10-29 22:10:02,10000,10000,"Lord watch over the people in that are or will be damaged by hurricane Sandy!..."
"2348",2012-11-05 14:22:50,40.7298,-73.9887,"Lots of respect for AOL: Patch and AOL Mobilize to Help Victims of Hurricane Sandy - Norristown, PA Patch http://t.co/IhnGlK2n"
"2349",2012-11-01 02:27:17,41.8795,-87.6243,"Lotta great raffle items to help with Hurricane Sandy relief efforts. Thanks to all who donated! http://t.co/yprvDIht"
"2350",2012-10-31 22:16:24,34.098,-118.327,"Louis C.K. Will Brave Hurricane To Host 'SNL': Louis C.K. Will Brave Hurricane To Host 'SNL'Wed, 10/31/2012 - 14... http://t.co/1nuSFO7n"
"2351",2012-11-04 23:56:20,25.7743,-80.1903,"Love him  RT @JohnnyMarines: @romeosantospage donating 30k earlier for Hurricane Sandy relief efforts http://t.co/wBP4YtLr"
"2352",2012-10-30 20:00:20,10000,10000,"""\""""Love to see when America comes together, Alabama power crews going up Interstate 85 northbound to help Hurricane Sandy victims\"""" #Sandy"""
"2353",2012-11-02 14:23:29,26.9337,-82.2322,"Loving the sight of the Church mobilizing to help those effected by hurricane Sandy!  #praying"
"2354",2012-11-01 15:22:44,10000,10000,"Lowe's To Donate $1 Million to Help Communities Affected By Hurricane Sandy http://t.co/I0vC623O #nascar @jimmiejohnson @teamhendrick"
"2355",2012-11-06 05:51:45,40.7561,-73.987,"&lt;em&gt;Mob Wives&lt;/em&gt; Star Crashes Hurricane Sandy Relief Effort http://t.co/UDRReIfk via @newyorkobserver"
"2356",2012-11-02 22:22:31,10000,10000,"&lt;---- I SAID needs some hurricane sandy relief pussy!!! WHERE THAT WARM FREE PUSSY AT?!??!?"
"2357",2012-11-02 11:24:11,40.8843,-72.3895,"Lutha's #Hamptons #SurfReport for Fri, 11/2/2012 - Stomach to chest high hurricane leftovers. W winds 10-15 KT w/ gusts to 25. Not too good."
"2358",2012-11-04 17:54:58,10000,10000,"#lyonsddd Sandy telethon raises $23 million for hurricane relief - USA TODAY: http://t.co/m2kxAcZO.auSa... http://t.co/TXdHRCjw @lyonsddd"
"2359",2012-11-01 01:36:48,10000,10000,"@maddow - It truly infuriates me when someone fakes sincere intentions as Romney has done to Hurricane Sandy victims and the Red Cross."
"2360",2012-11-03 03:58:15,40.7561,-73.987,"Madison Square Garden Company Donates $500KHosts Telethon to Benefit Hurricane Sandy Relief Efforts  News   http://t.co/ZZVo8dq4"
"2361",2012-11-03 05:33:46,31.5524,-97.1191,"Major respect @DwyaneWade making the $210,000 donation to Hurricane Sandy relief. Nothing but respect & admiration for the selflessness act"
"2362",2012-11-05 17:11:07,49.8955,-97.1383,"Major Retailers Giving Back! Retailers Pitch in to Help Hurricane Sandy Victims via @RTouchPoints http://t.co/4PmzKT65"
"2363",2012-10-30 18:46:10,38.5737,-121.55,"Make a difference today, help those affected by Hurricane Sandy. http://t.co/38mUdrrE"
"2364",2012-11-01 16:41:57,10000,10000,"@MariahCarey It would be nice if you could participate in this NBC telethon for Hurricane Sandy victims http://t.co/khdXFBJI"
"2365",2012-11-05 10:15:14,40.7561,-73.987,"Marines begin Hurricane Sandy relief work in Queens and Staten Island: They<U+FF92>re storming the beaches!\A wave of Marines hit the most h..."
"2366",2012-11-02 22:08:06,10000,10000,"Mark Cuban, NBA owner donates $1 million to hurricane relief.  Mitt Romney donates 5000 cans of food the Red Cross doesn't want for photo op"
"2367",2012-11-03 01:07:21,10000,10000,"Mary J Blige performed for Hurricane Sandy relief effort, but who will perform and raise money for the relief of her voice."
"2368",2012-11-05 13:19:08,41.8795,-87.6243,"@MarySarahMusic: Thank you for featuring Hurricane #Sandy Relief Run http://t.co/6mWcE3PL on #BOOM Daily!  @TheHenningsens @Merber38"
"2369",2012-11-07 23:24:31,53.4807,-2.23438,"#Mashable Airbnb Lets Kindhearted New Yorkers Offer Free Housing For Hurricane Sandy Victims http://t.co/1ibHxGGN"
"2370",2012-11-02 21:29:41,10000,10000,"Maybe all this money spent on political ads could have been used to help the victims of hurricane sandy... #justathought"
"2371",2012-11-02 10:28:00,10000,10000,"MAYBE OBAMA NEEDS TO GET THE UN TO COME HELP HURRICANE SANDY VICTIMS.. OR. APPOINT A DISASTER SEC..  PEOPLE ARE AWAKENING!  ROMNEY/RYAN 2012"
"2372",2012-10-30 16:37:42,10000,10000,"May god help everyone that's been damaged by hurricane sandy"
"2373",2012-11-03 03:32:12,40.7561,-73.987,"mayor bloomberg is a billionaire, he should atleast put up 1 billion of his own money to help the hurricane victims. #Sandyhelp"
"2374",2012-11-06 01:46:32,29.9532,-90.069,"MAYOR LANDRIEU ANNOUNCES BENEFIT CONCERT TO SUPPORT HURRICANE SANDY RELIEF EFFORTS #constantcontact http://t.co/JOr8j8b8"
"2375",2012-11-02 18:36:34,37.0902,-95.7129,"McDonald's Makes Donation to Hurricane Sandy Disaster Relief Efforts | Nov 02, 2012 (Marketwire via COMTEX)... http://t.co/3HcxA1bb"
"2376",2012-11-04 13:54:28,20.5937,78.9629,"Meatball To The Rescue! Snooki Gathers Clothes For Hurricane Sandy Victims ... - Global Grind: http://t.co/nPOUKT3x #clothes"
"2377",2012-11-01 22:28:17,-2.20382,-79.8975,"Media Giants Set Plans to Help Hurricane Sandy Relief http://t.co/ju5zUSgZ"
"2378",2012-11-05 15:02:21,29.9918,-95.3927,"Medtronic Foundation Donates $250,000 to Hurricane Sandy Relief Efforts http://t.co/MWppp3f8 #pressrelease #news"
"2379",2012-11-05 14:07:23,40.7561,-73.987,"Megan&#039;s Hurricane Sandy Relief Effort Was a huge Success http://t.co/8EKzXGt6 via @megapeach21"
"2380",2012-11-05 19:29:48,42.4805,-83.4955,"@megyn kelly Deploy the full might of the US Military to help the hurricane victims."
"2381",2012-11-06 04:36:19,38.8921,-77.0241,"Memo to Fox: Obama admin's Hurricane Sandy relief efforts were not the same as Bush admin's response to Katrina http://t.co/xYsqztzj"
"2382",2012-11-04 04:31:38,10000,10000,"#mensrights@reddit Hurricane Sandy Blew All The Useful Women Away: submitted by  actanonverb... http://t.co/tkjnROob - - - - - - - - - -"
"2383",2012-11-02 00:44:40,35.9295,-86.8419,"Mercedes-Benz USA will donate $1,000,000 to the American Red Cross to help with the utter destruction caused by hurricane Sandy."
"2384",2012-11-04 16:42:18,43.6702,-79.3868,"Me: they raised 23 million for the Red Cross hurricane Sandy relief\Jody: Katy Perry wears a skintight dress\Me: now THAT'S breaking news"
"2385",2012-10-31 18:04:26,10000,10000,"#Mets donate a box of chocolates. @eboland11: Yankees will donate $500,000 to the American Red Cross to support relief...Hurricane Sandy."
"2386",2012-11-01 20:04:17,40.2466,-76.8941,"Midstate hotels band together to help hurricane victims: http://t.co/1e3qywTb"
"2387",2012-10-31 17:21:51,40.7561,-73.987,"Might sign up for Hurricane Sandy relief through school. I mean why not?"
"2388",2012-10-31 16:37:57,51.0551,-114.062,"@MittRomney at #Sandy 'relief' event compares hurricane recovery to picking up 'rubbish and paper'! | http://t.co/V6SbvmRb from @firedoglake"
"2389",2012-10-31 00:13:31,10000,10000,"Mitt Romney donates millions to charity and he asked for donations for hurricane victims and PRAVDA (MSNBC) excoriates him. So Cute. #EdShow"
"2390",2012-10-30 20:51:49,25.7743,-80.1903,"Mitt Romney says I want to help hurricane relief efforts. Let's turn this campaign rally into a canned food drive."
"2391",2012-10-30 18:48:15,42.6472,-70.6269,"Mitt Romney To Sponsor Hurricane Sandy Relief Fundraiser In The Cayman Islands"
"2392",2012-10-30 03:53:56,10000,10000,"@MizzHogan Can you please ask impact wrestling to make a donation to help the victims of hurricane Sandy? They need the help badly."
"2393",2012-10-31 18:50:47,10000,10000,"<U+FF93>@MLB: The @Yankees will donate $500,000 to aid with Hurricane Sandy relief efforts.<U+FF94> #respect"
"2394",2012-11-04 12:28:40,52.1326,5.29127,"MonaVie Donates 75,000 Nutritional Bars to Hurricane Sandy Victims http://t.co/HwVOrNkf"
"2395",2012-11-03 01:45:30,56.1304,-106.347,"More athletes need to take a page out of Dwayne Wades book.. Donating $210,000 to hurricane relief fund. #wow"
"2396",2012-11-02 20:01:49,10000,10000,"More Hurricane Relief Efforts http://t.co/eZxkcvDc #siopen #nyc #sandy #statenisland"
"2397",2012-10-30 22:06:45,38.7847,-90.498,"More updates to come on how to help hurricane victims.Assessing how CSI can best help.We aren't biggest non-profit but we will do our part!"
"2398",2012-11-05 18:56:27,51.5002,-0.126236,"#Movies Hurricane Sandy Relief Roundup: Jersey Shore Cast Doing Live Special, ABC Sets Up Star-Studded Phone Ban... http://t.co/Koz44DCd"
"2399",2012-11-02 21:58:26,10000,10000,"MSG staff and @nyknicks dancers preparing for pre-game ceremony tonight, moment of silence for hurricane victims http://t.co/khiO43jE"
"2400",2012-11-01 03:22:12,40.6752,-73.971,"MSNBC bashes Romney over Ohio based Hurricane Sandy relief event, didn't mention 2 huge tv screens at event w/msg... http://t.co/fLUOgzJC"
"2401",2012-11-02 04:12:50,44.516,-88.0079,"My boy Charles Woodson of the Green Bay packers is donating $100,000 to those affected by hurricane sandy!!! #midewest at its best!!"
"2402",2012-11-03 00:13:45,10000,10000,"My @DwyaneWade is donating his salary tonight to Hurricane Sandy relief, roughly $210,000 #Thatsmyboy #Respect"
"2403",2012-11-02 12:13:51,43.4114,-106.28,"my heart goes out to all the volunteers of all the agencies trying to help the victims of hurricane Sandy. It is a daunting task. God bless."
"2404",2012-11-03 16:40:24,40.5795,-74.1502,"My mom just got 75$ worth of school supplies to donate to kids from the hurricane ????????????"
"2405",2012-11-05 22:27:11,40.0583,-74.4057,"My other baby ROBINSON CANO donated 25 thousand dollars to help out w. The destructions of the hurricane :) aww"
"2406",2012-11-05 13:29:27,10000,10000,"Nahh, you gotta twitpic for Hurricane Sandy Relief RT @NikkieeJ_: I should start my morning off by sending @stushahliee some nudes \\355\\240\\275\\355\\270\\211 lol"
"2407",2012-10-31 19:05:01,38.8921,-77.0241,"#NAHN would like to send our prayers and best wishes to those affected by Hurricane Sandy. We all can help by... http://t.co/y2h3eHwv"
"2408",2012-11-05 14:37:47,10000,10000,"Navy News Service:NEW YORK-Mobile Diving and Salvage Unit 2 Sailors dewater World Trade Center Hurricane Sandy relief http://t.co/IKcrCNcU"
"2409",2012-11-02 07:04:31,31.9525,-102.173,"NBA and NBPA donate $1 million to Hurricane Sandy relief - The National Basketball Association (NBA) and the... http://t.co/z2vfDxT1"
"2410",2012-11-02 00:03:59,10000,10000,"NBA and NBPA pledge $1 million for Hurricane Sandy relief efforts: The NBA and NBPA have pledged to donate $1 mi... http://t.co/jN4qn3A3"
"2411",2012-11-07 17:20:37,39.321,-111.094,"NBA and NBPA Pledge $1 Million to Support Hurricane Sandy Relief Efforts http://t.co/CgIA5F9w"
"2412",2012-11-03 22:07:02,10000,10000,"#NBA #Heat #Wade Dwyane Wade Will Donate Game Check to Hurricane Sandy Relief Charities http://t.co/7ofHS8qf #AutoFollowBack GGooo"
"2413",2012-11-06 03:52:53,37.0902,-95.7129,"NBA, NBPA Donate $1,000,000 to Hurricane Relief Efforts: \\\\The National Basketball Association and National Ba... http://t.co/Um17T9dk"
"2414",2012-11-03 22:45:55,10000,10000,"NBC is saying they raised nearly $23 million with last night's fundraiser for Hurricane Sandy/the Red Cross. Yay lovely, charitable people!"
"2415",2012-11-01 19:15:10,34.0522,-118.243,"NBC plans star-studded benefit for victims of Hurricane Sandy http://t.co/3GtGWQhk"
"2416",2012-11-01 16:31:47,33.7545,-84.3897,"NBC Universal, News Corp. Set Plans to Help Hurricane Sandy Relief: Major media companies a... http://t.co/Ko9f6jJ7 #industrynews #adage"
"2417",2012-11-07 19:21:12,40.7561,-73.987,"NEFCU is supporting our community through Hurricane Sandy relief programs, offering a variety of special loans... http://t.co/2NVX7JiM"
"2418",2012-11-05 11:47:57,10000,10000,"Nestle Waters North America Sends 5.4 Million Bottles of Water To Hurricane Sandy Victims http://t.co/KvMBbi4l"
"2419",2012-11-01 14:49:42,41.8031,-87.957,"New blogpost: Hurricane Sandy Relief http://t.co/8TgP3itS"
"2420",2012-10-31 17:51:53,36.7783,-119.418,"""New Blog Post: Rep. Steve King: Hurricane Sandy Relief Money shouldn't Go for \""""Gucci Bags And Massage Parlors\"""" http://t.co/wuY3M3ZU"""
"2421",2012-11-05 16:48:11,10000,10000,"New Books for Victims of Hurricane Sandy - Sacramento Bee http://t.co/4n97U7zK"
"2422",2012-11-01 19:34:35,42.6517,-73.7551,"New PHT -  Blues, Preds alumni to play charity game for Hurricane Sandy relief http://t.co/fVSNbjXP"
"2423",2012-11-01 15:46:38,10000,10000,"New post: BMO Capital Markets Donates $150,000 to American Red Cross to Support Hurricane Sandy Relief Efforts http://t.co/5McyjpzK"
"2424",2012-11-05 10:09:27,49.1988,-122.846,"News Corp is donating 1m dollars to help the victims of Hurricane Sandy. Isn't it strange how the TV doesn't mention that?"
"2425",2012-11-01 17:14:42,10000,10000,"News Corporation Announces $1 Million Donation to Hurricane Sandy Relief Efforts http://t.co/XweLnkBY"
"2426",2012-11-01 04:38:39,10000,10000,"News Corporation will donate $1 million to help victims of Hurricane Sandy."
"2427",2012-10-31 23:12:39,10000,10000,"News Corp. to Donate $1 Million to Hurricane Sandy Relief Efforts: The funds will be evenly divided between New ... http://t.co/snfsFl0p"
"2428",2012-11-01 15:49:16,40.7561,-73.987,"News from #NYSLSA: more Hurricane #Sandy relief info http://t.co/g0yqMDYp"
"2429",2012-11-03 18:41:28,10000,10000,"New Update on District 9 Hurricane Sandy Relief #constantcontact http://t.co/QHyrKTGN"
"2430",2012-11-01 21:05:34,38.9125,-94.3762,"New Yorkers take to social media to find, provide help after Hurricane Sandy | The Raw Story http://t.co/vYuoHaOx @jessicalawrence"
"2431",2012-10-31 22:11:16,10000,10000,"New York homeowners will not have to pay hurricane insurance deductibles on homes damaged by Hurricane Sandy, Go... http://t.co/e4rsgdoY"
"2432",2012-11-06 00:23:43,10000,10000,"New York Yankees collecting and distributing donations for victims of Hurricane Sandy, which means Alex Rodriguez is handing out goose eggs."
"2433",2012-10-30 20:33:07,37.6152,-122.39,"Next up, how to make money off the hurricane, start asking for donations and dribble 1% to actual victims."
"2434",2012-11-02 02:05:03,10000,10000,"NFL and NBA donate to Hurricane Sandy victims http://t.co/OnHPZdpD"
"2435",2012-11-01 19:51:31,10000,10000,"NFL donated $1 million to the Red Cross to help fund the recovery from Hurricane Sandy..THATS IT? Even the BENCH players have more than that"
"2436",2012-11-01 19:40:21,10.254,-68.0109,"#NFL #Football || NFL, NFLPA to donate $1 million for Hurricane Sandy relief http://t.co/NhzNCX8h v<U+FFFD>a @NFL"
"2437",2012-11-03 02:49:27,10000,10000,"<U+FF93>@nfl: NFL, NFLPA to donate $1 million for Hurricane Sandy relief: http://t.co/rogBHlWR<U+FF94>. Really?  That's it?  You assholes."
"2438",2012-11-01 21:48:01,10000,10000,"NFL-NFLPA to Donate $1 Million to Aid Those Impacted By Hurricane Sandy http://t.co/ZpgoDj9x"
"2439",2012-11-02 13:33:01,10000,10000,"NFL-NFLPA To Donate $1 Million To American Red Cross To Aide Hurricane Sandy Victims: The National Football Leag... http://t.co/USfu4USb"
"2440",2012-11-05 22:40:29,42.3589,-71.0578,".@NFLPlayersUnion to donate $1 million to @RedCross to benefit Hurricane #Sandy relief http://t.co/8b0XSJcE"
"2441",2012-11-02 13:21:40,41.8781,-87.6298,"Nice&gt;&gt;&gt; Abbott and the Abbott Fund Donate $1 Million in Funding and Products to Support Hurricane Sandy Relief Efforts\#goodcompany"
"2442",2012-11-02 21:52:09,39.9516,-75.1638,"Nice move by Dwyane Wade to donate tonight's game check ($210,000) to victims of Hurricane Sandy."
"2443",2012-11-03 03:35:13,36.4596,-83.6504,"""\""""@niggerRay: Just donated to the Hurricane Sandy Relief, $10 goes a long way. #NBACares #Clippers\"""" I see you"""
"2444",2012-11-01 22:54:41,40.0583,-74.4057,"NJED Disaster Relief | TeacherCast http://t.co/dxXUI54b Want to help with Hurricane Sandy?  #njed #edchat"
"2445",2012-11-05 21:01:18,40.0583,-74.4057,"@NJLLS Opens doors to Hurricane #Sandy victims. http://t.co/XEIndAdd #SandyAftermath"
"2446",2012-11-04 21:50:20,39.9516,-75.1638,"#nj Occupy Sandy Relief | New Jersey Relief Effort for Hurricane Sandy: Occupy Sandy Relief | ... http://t.co/w7VMbTck #freetransit #ows"
"2447",2012-10-30 16:41:07,40.6021,-75.4717,"""NJ Transit: System has experienced \""""unprecedented devastation\"""" in wake of Hurricane #Sandy. Visit http://t.co/lfEQpDvs for service updates."""
"2448",2012-11-02 19:24:42,32.7549,-97.3303,"Non-Union workers are being kicked out of Hurricane #Sandy relief efforts. #laughable #obamasamerica"
"2449",2012-11-03 01:11:01,43.4655,-81.1922,"No offence Joe Nathan but a $12500 donation to hurricane Sandy is a joke when you made $108000 per inning pitched last year totaling $7 mill"
"2450",2012-10-30 19:11:32,10000,10000,"Noooooo.... #NewJersey #SeasideHeights #JerseyShore completely damaged by hurricane"
"2451",2012-11-02 18:39:44,36.8546,-76.2744,"Norfolk Southern Foundation makes gift of $100,000 to the @RedCross in support of Hurricane #Sandy recovery efforts. http://t.co/G0zaASm5"
"2452",2012-10-30 23:46:19,46.7791,-92.1082,"Northland Agencies Help Victims of Hurricane Sandy: Duluth, MN (Northland<U+FF92>s NewsCenter) --- Crews from numerous ... http://t.co/YLdBfSpS"
"2453",2012-11-01 17:23:52,42.3589,-71.0578,"Not enough RT@pgammo NEW YORK YANKEES TO DONATE $500,000 TO HURRICANE SANDY RELIEF EFFORTS IN TRI-STATE AREA"
"2454",2012-11-06 10:21:07,40.7561,-73.987,"Nothing else matters today except Vote Obama+ Hurricane relief efforts. God bless America. #Vote today."
"2455",2012-11-04 13:08:33,20.5937,78.9629,"NYC Runners and Race Organizers Help with Hurricane Relief Efforts:  http://t.co/VJFucbGK"
"2456",2012-11-05 14:05:09,40.7561,-73.987,"NYC's public hospital system & @THEREALSWIZZZ launch the Hurricane Sandy Relief Effort: http://t.co/GJ5jLWZW"
"2457",2012-10-31 18:30:15,10000,10000,"<U+FF93>@NYDNsports: Yankees to donate $500,000 to Hurricane Sandy relief: http://t.co/B50vhbV6<U+FF94> BAM!!"
"2458",2012-11-05 16:56:26,40.7144,-74.006,"@NYGovCuomo Gov. Cuomo: Why not request USS Enterprise & 2 US Hospital Ships to assist in Hurricane Sandy relief!\Enterprise has everything."
"2459",2012-10-29 13:03:34,10000,10000,"<U+0093>@nytimes: Map: Find Hurricane #Sandy shelters and evacuation sites in New York City's five boroughs http://t.co/JxBJQH3u<U+0094> @Itachill"
"2460",2012-11-04 08:18:53,10000,10000,"#Obama2012slogans Keep me in office and I will help Hurricane Sandy victims. Gov't help should be there by February or March...um...2016."
"2461",2012-10-31 01:59:27,43.1048,-88.3434,"Obama and his advisers are such transparent manipulators. Enough said. God help us to help the hurricane victims restore their lives.  #tcot"
"2462",2012-10-30 18:48:42,41.8795,-87.6243,"Obama Heads To Red Cross In Aftermath Of Hurricane Sandy http://t.co/5dQnJAqw"
"2463",2012-11-02 19:26:11,31.9686,-99.9018,"Obama is having a great time in vegas while hurricane sandy victims are eating out of trashcans.. but he can help hurricane Katrina victims?"
"2464",2012-10-31 19:25:19,43.6132,-83.8472,"Obama is visiting hurricane Sandy victoms in NJ today while Romney is only encuraging donations to the Red Cross hmmmmmm"
"2465",2012-11-03 17:35:23,41.5623,-72.6507,"Obama says he won't let 'red tape' get in the way of helping Hurricane Sandy victims. http://t.co/FDtPObaP   #ctsandy #Obama (AP)"
"2466",2012-11-02 17:30:56,37.9643,-91.8318,"Obama's union thug buddies won't let non-union volunteers help with Hurricane Sandy relief... only in Obama's America...."
"2467",2012-10-29 16:51:26,10000,10000,"#Obama: Visit http://t.co/jYqPXtlf for info. on how to prepare your families for this storm....#Hurricane #Sandy"
"2468",2012-11-04 23:37:17,37.8044,-121.811,"Occupy Activists leading the hurricane relief efforts in NYC #OccupySandy  http://t.co/QolaL4oN"
"2469",2012-11-03 04:33:42,29.9918,-95.3927,"<U+0093>@OccupySandy: If u want to help w Hurricane #Sandy relief, plz visit our Faceook page http://t.co/nAwJsgLs #volunteer #SandyVolunteer"
"2470",2012-11-03 00:51:07,35.201,-91.8318,"Occupy Sandy: self-organized/horizontal/P2P hurricane relief effort http://t.co/SEm3NB2T"
"2471",2012-11-05 04:20:40,45.9638,-112.494,"Occupy Wall Street is leading the Hurricane Sandy relief effort with their #OccupySandy campaign. @OccupySandy \http://t.co/TurLm3NV via"
"2472",2012-11-02 19:43:13,10000,10000,"@ochocinco you doin anything to help the victims of hurricane sandy? I'm sure you have plenty of time on your hands ??"
"2473",2012-11-01 16:33:51,10000,10000,"@OFA_WI ANN C. HERE: So the ROMNEY team raises $882,000,000 but DONATES ONLY $5,000 TO HURRICANE VICTIMS. That's LESS THAN 00.000568%. Ouch!"
"2474",2012-11-03 00:08:18,41.6032,-73.0877,"<U+0093>@official1DSTUSA: Hope everyone's watching Hurricane Sandy's benefit concert on NBC! Donate to help out everyone in NJ and NY xx<U+0094> NO POWER"
"2475",2012-11-01 23:32:07,27.6648,-81.5158,"Oh and I donated $3 to the Hurricane Sandy foundation #YeahImASaint ??"
"2476",2012-10-31 04:42:31,10000,10000,"oh yeah I made a donation to the Hurricane Sandy relief efforts if yall had cared or w/e"
"2477",2012-10-31 14:25:05,35.4931,-97.4591,"Oklahoma Governor Sends Team To New York To Help Hurricane Recovery Efforts: Oklahoma Governor<U+FFA0>Mary Fa... http://t.co/tyxNtf0P #oklahoma"
"2478",2012-11-03 00:48:36,40.0583,-74.4057,"@olivia_loesner you were on the hurricane sandy relief benefit!!"
"2479",2012-10-28 05:22:08,10000,10000,"On a scale from 1 to hurricane sandy, fuck you"
"2480",2012-11-04 19:36:55,38.7422,-90.3658,"On a scale from 1 to Hurricane Sandy, last night was Hurricane Katrina. #awful"
"2481",2012-11-03 21:26:08,10000,10000,"One of my signs to be held tomorrow morning #hurricane #sandy #relief #comedonate http://t.co/4IoXnGhJ"
"2482",2012-10-30 21:04:07,10000,10000,"On Friday, 11/2, Carmelina's Taqueria will donate 10% of its sales to the Red Cross to help victims of Hurricane Sandy. http://t.co/MPYTb7oE"
"2483",2012-11-01 16:35:28,34.0522,-118.243,"Online Consignment Shop ThredUP Launches Digital Fundraising Platform Called <U+FF93>Groups,<U+FF94> Now Raising Money For Hurricane http://t.co/FxC5cDEP"
"2484",2012-11-05 00:36:40,39.9516,-75.1638,"on @Slate - Is Occupy Wall Street Outperforming the Red Cross in Hurricane Relief? #Sandy @OccupySandy @njdotcom  http://t.co/yMOMomHD"
"2485",2012-11-03 01:07:13,37.977,-87.5422,"@OpieRadio Dwyane Wade giving $200,000 to hurricane relief #SandyHelp ... How much are you giving Opie. You talk a big game on the radio."
"2486",2012-11-05 17:40:05,10000,10000,"""Os caras sabem ganhar dinheiro.... | Grey Area | \""""I STILL LOVE NY\"""" Hurricane Sandy relief T-Shirt https://t.co/O4ARsb9X"""
"2487",2012-11-05 18:22:19,41.8795,-87.6243,"Our Hearts go out to Hurricane Sandy Victims http://t.co/w7ga0H7E"
"2488",2012-11-01 14:38:18,33.5778,-101.854,"Our Hurricane Sandy shelter counts are fluctuating as power outages continue.  The night of the storm we provided... http://t.co/I5uLuOBC"
"2489",2012-11-01 17:38:35,39.9516,-75.1638,"Our November newsletter is out.  Our staff just made a donation to the Red Cross for Hurricane Sandy relief... http://t.co/CqUzA76f"
"2490",2012-10-30 18:20:06,29.76,-95.3625,"Our prayers and thoughts are with everyone on the East Coast that had been hit by Hurricane Sandy!  The Red Cross... http://t.co/rIjJbz2J"
"2491",2012-10-30 20:02:33,41.9528,-70.67,"Our President Obama visits the Disaster Operation Center of the Red Cross - pics\http://t.co/PVpGd4pN #Sandy #hurricane @Obama2012 #p2b #p2"
"2492",2012-10-30 21:10:50,32.8917,-96.9483,"Our thoughts are with the people who were affected by the destruction of Hurricane Sandy. Visit http://t.co/47e2bkCZ... http://t.co/nD6BCmDl"
"2493",2012-10-30 21:22:42,37.0902,-95.7129,"Our thoughts go out to those affected by Hurricane Sandy and the emergency and relief crews working to help those affected."
"2494",2012-11-03 16:43:39,40.4384,-80.0019,"Over $500 raised since last night! Shop a cause to help #hurricane #sandy victims. LOVE my job, allows me to give back: http://t.co/GbJfQnEp"
"2495",2012-11-02 15:13:56,43.7844,-88.7879,"Packers Daily Links: Woodson Pledges $100,000 to Hurricane Relief: Packers defensive back Charles Woodson spoke ... http://t.co/Gca799KL"
"2496",2012-11-03 01:52:58,43.6702,-79.3868,"#Paris Lend a hand to New York. Hurricane Sandy relief funds Donate directly from iTunes or go directly to Red Cross- 1 800 HELP NOW"
"2497",2012-11-05 23:32:58,33.8874,-118.396,"Patch & AOL have partnered to provide assistance & relief to Hurricane Sandy victims. http://t.co/aSu0o6qg"
"2498",2012-11-06 00:42:26,41.0393,-73.6301,"Patch & AOL Send Hurricane Sandy Relief Trucks to Long Island, New Jersey - Greenwich, CT Patch http://t.co/ohRDb4Bd"
"2499",2012-10-31 23:13:03,27.6648,-81.5158,"Pathetic how the same Romney that raised MILLIONS $$$ at campaign fundraisers only managed $5000 for hurricane victims. @TheRevAl"
