"","Datetime","Latitude","Longitude","Message"
"1536",2012-11-02 23:05:06,10000,10000,"@BrianDawkins Please RT: If you can, Donate. Text REDCROSS to 90999 to give $10 to much-needed Hurricane Sandy storm relief."
"1537",2012-11-02 19:03:44,42.3589,-71.0578,"@BostonTweetUp thanks for the tweet. we'll also be collecting donations for #sandy hurricane relief."
"1538",2012-11-05 19:16:58,10000,10000,"Book Outer Banks Rentals & Support Hurricane Sandy Relief http://t.co/TvjMkwoD"
"1539",2012-11-01 14:48:44,46.5149,-84.358,"#BNI has a fund set up w/the #RedCross for Hurricane #Sandy Relief - 100% of your donations go directly to the source: http://t.co/tmynu0ID"
"1540",2012-11-03 19:28:34,10000,10000,"<U+FF93>@blink182: You can help out the victims Hurricane Sandy with this blink-182 t-shirt http://t.co/MSvZXtXc<U+FF94> dude"
"1541",2012-11-03 22:34:22,40.7561,-73.987,"Blink-182: Hurricane Sandy Relief Shirts - Blink-182 have released a Hurricane Sandy Relief Shirt to help tho<U+FF85> http://t.co/ZtBGcPMb"
"1542",2012-11-06 01:58:49,42.3589,-71.0578,"Blankets For Sandy: Donate To Victims Of The Hurricane http://t.co/1TvSAt8S"
"1543",2012-11-01 19:53:44,40.6925,-73.9203,"BHaus to donate main foor after 7pm and on Sundays for volunteer/fundraising efforts for those affected by hurricane. Help spread the word!"
"1544",2012-11-03 00:51:14,10000,10000,"Between the pictures and the songs the telethon for Victims of hurricane Sandy is emotional  #SandyHelp or text <U+FF93>RedCross<U+FF94> to 90999."
"1545",2012-11-03 04:13:34,10000,10000,"Better aku derma kat Afghanistan/Palestin. Lagi berbaloi RT @Fergie: Help those affected by Hurricane Sandy. Text ... http://t.co/8mRyKgoQ"
"1546",2012-11-06 01:49:42,10000,10000,"Be sure to tune into #DWTS to find out how to donate to the victims of Hurricane Sandy or visit http://t.co/XpnsUeOn #dayofgiving"
"1547",2012-11-05 14:31:58,40.6752,-73.971,"Benefit! @GaryClarkJr playing @brooklynbowl  for hurricane relief 11/6 $20 on sale today at noon: http://t.co/hjsjPuae"
"1548",2012-11-02 08:12:23,33.9474,-117.4,"Before you go out drinking all weekend, text REDCROSS to 90999 and donate $10 to Hurricane Sandy relief. They need it more than you do."
"1549",2012-11-03 02:41:46,10000,10000,"Before sandy. To help the victims of hurricane Sandy, text REDCROSS to 90999 to make a $10 donation to the R http://t.co/A1UMSFcL"
"1550",2012-11-04 19:08:01,-12.0931,-77.0465,"#Be'er_Mayim_Chaim HOW YOU CAN HELP THE HURRICANE VICTIMS http://t.co/bo1ymkLy"
"1551",2012-11-03 23:30:34,34.0522,-118.243,"Beauty411 Weekend Digest: Giving Back and How to Help Hurricane Sandy Victims http://t.co/RSOoph8O\ #beauty #blogs"
"1552",2012-10-31 13:49:31,10000,10000,"Be a hero like heroes donating funds to help Hurricane #Sandy aftermath &  blood & platelet donations via #RedCross etc. (Heroes  pray too)"
"1553",2012-11-06 16:40:41,34.7244,-92.2789,"BCC for Hurricane Sandy Relief | BCC 's Fundraiser on CrowdRise http://t.co/eUGZ4T6E"
"1554",2012-11-01 01:56:08,35.7915,-78.7811,"""@BAudienceDriven =&gt; Help Hurricane Sandy victims <U+FF96> AT&T customers can text \""""REDCROSS\"""" to 90999 to donate $10. @ATT @redcross"""
"1555",2012-11-01 21:01:15,10000,10000,"Bartending Dizzys tn, We will be donating $1 to Hurricane Sandy Relief for every person that uses a guest-list, Use my name! Come support :)"
"1556",2012-11-03 16:32:36,60.1282,18.6435,"#Autofollow CBC.caVolunteer Opportunities to Help Hurricane Sandy Victims this WeekendPeter Green... http://t.co/GncXwTRd @Generation404"
"1557",2012-10-31 00:22:56,36.7783,-119.418,"""@AubreyODay please RT Help victims of Hurricane #Sandy and places affected, by texting \""""REDCROSS\"""" to 90999 make $10 donation! ?"""
"1558",2012-11-01 03:01:29,42.2774,-83.7333,"At this time, one needs to be over 18 to help with the Hurricane Sandy clean up.  Are you interested?  Let me know."
"1559",2012-10-30 02:03:52,10000,10000,"Attention everyone! please contribute to the hurricane sandy relief program by donating tampons and tylenol , it's her time of the month ."
"1560",2012-11-01 14:54:09,10000,10000,"""\""""As we consider those affected by Hurricane Sandy, the Red Cross has an urgent need for all blood types...\"""" #dosomething #giveblood #pray"""
"1561",2012-11-04 16:14:39,39.9516,-75.1638,"@AStolarz33 hey Anthony, help us with our #sandy hurricane relief efforts.  http://t.co/01hU4cWC"
"1562",2012-11-02 20:18:23,40.1385,-75.1918,"A special #FunVideoFriday: donate blood to @RedCross to aid Hurricane #Sandy victims here in PA & all along East Coast. http://t.co/CMSFQXgU"
"1563",2012-11-01 21:30:54,39.9516,-75.1638,"As Hurricane Sandy Relief Efforts Continue, Here's How You Can Help @Forbes http://t.co/JaUR7OTK #sandy"
"1564",2012-11-04 18:05:11,40.7566,-73.9863,"Artists Raise Awareness, Funds for Hurricane Sandy Relief http://t.co/RnCYcpnz"
"1565",2012-11-06 02:52:03,35.7596,-79.0193,"Artists give back....here's another way you can help with the hurricane relief efforts. Pre-purchase prints of... http://t.co/19fqyQRj"
"1566",2012-11-02 16:09:31,40.4173,-82.9071,"""Art fundraiser for Hurricane Sandy relief at Daily Paintworks, including my own \""""Brownstone with Geraniums\"""".  http://t.co/r7CFMr6s"""
"1567",2012-11-04 23:05:50,40.7029,-74.3788,"Are you looking for information on how you can help recovery efforts and survivors of Hurricane Sandy? Visit... http://t.co/JSyczrsu"
"1568",2012-10-30 17:57:02,38.99,-77.1214,"Are you looking for a way to help Hurricane Sandy relief? Check out Network for Good's page: http://t.co/HuIqxtaU http://t.co/TqGWT7Wz"
"1569",2012-10-31 00:41:04,31.9686,-99.9018,"A really good site if anyone wants to make a donation to help people affected by Hurricane Sandy http://t.co/V0Cd6ZqR"
"1570",2012-11-03 00:18:57,10000,10000,"A quick way to help-You can text REDCROSS to 90999 to make a $10 donation to help Hurricane Sandy victims #sandyhelp"
"1571",2012-11-03 18:36:04,10000,10000,"App of the Week: Hurricane by American Red Cross: Verizon is pledging to match customer's Red Cross donations up to... http://t.co/yoe3zUjF"
"1572",2012-11-02 10:14:06,43.6702,-79.3868,"Apple system enables your donations to help the victims of Hurricane Sandy http://t.co/aPZtrHgN"
"1573",2012-11-01 21:24:17,37.7752,-122.419,"Apple<U+FF92>s iTunes Store now accepting Red Cross donations for Hurricane Sandy aid (MacDailyNews/MacDailyNews) http://t.co/1hujfQks"
"1574",2012-11-01 11:58:51,55.3781,-3.43597,"#Apple #News iTunes now accepts donations for Hurricane Sandy relief http://t.co/cJlKIDuW"
"1575",2012-11-02 12:35:29,10000,10000,"""Apple enables Donations for Hurricane \""""Sandy\"""" victims on#iTunes http://t.co/VtWWKSRg"""
"1576",2012-11-04 21:36:49,51.5902,-0.017402,"AphroChic: The Week In Review: 11.2.12.  Help victims of Hurricane Sandy by purchasing this print fr http://t.co/7pbfkyXw"
"1577",2012-11-01 15:43:12,33.7545,-84.3897,"Anyone? RT @KyleVanPelt: @jc I'm trying to find a designer who can make a quick logo for Hurricane Sandy relief efforts. Know anyone?"
"1578",2012-11-05 17:44:49,10000,10000,"anyone interested in donating to the Hurricane Sandy Relief Drive-Monday, Nov 5th to Sat, Nov 10th we can come... http://t.co/yhLX7JoC"
"1579",2012-10-31 17:20:22,30.4382,-84.2806,"Another place to donate for Hurricane Sandy relief is https://t.co/nkbOjqr1"
"1580",2012-11-04 01:11:16,41.2035,-77.2679,"Another photo! 20 percent goes to Red Cross for Hurricane Sandy Relief #sandynj The Wonder Bar in Asbury http://t.co/QsaXVwvZ via @Etsy"
"1581",2012-11-04 16:52:09,40.0583,-74.4057,"Another great event benefitting Hurricane Sandy relief efforts! #SCBD http://t.co/btOFLdAq"
"1582",2012-11-07 21:15:38,34.0522,-118.243,"{announcement} how to help those affected by hurricane sandy: http://t.co/z6lrGihO Pls RT! #sandy #volunteer #hurricanesandy"
"1583",2012-11-03 00:26:04,40.7561,-73.987,"""<U+FF93>@AndreaButera: If you aren't watching, turn to NBC or TWC & watch \""""Hurricane Sandy: Coming Together\"""" and pls text REDCROSS to 90999 & help"""
"1584",2012-10-31 19:01:03,10000,10000,"<U+FF93>@andersonlive: How to Help Victims of Hurricane #Sandy: http://t.co/UNzp4SFr<U+FF94> please help."
"1585",2012-11-01 03:33:50,29.1855,-82.1404,"And being a classy motherfucker, Colbert is politely asking people to donate to the victims of Hurricane Sandy. Like a boss."
"1586",2012-10-31 19:06:49,52.3754,6.08927,"Amway Red Cross Hurricane #Sandy Relief Fund Donation $10'...  http://t.co/Fc43Zbr5  #RedCross #Amway #victems #safility"
"1587",2012-10-31 12:45:50,43.1939,-71.5724,"AMERICA, TIME TO RALLY TO HELP HURRICANE SANDY VICTIMS, PRESIDENT NEEDS OUR HELP!!"
"1588",2012-10-30 19:54:55,41.1565,-81.8645,"American Red Cross needs us! Hurricane Sandy has canceled 300 blood drives. Click here for ways to help & give support! http://t.co/3AUz78NV"
"1589",2012-11-02 16:47:12,31.9525,-102.173,"American Red Cross Fundraise for Hurricane Sandy Victims http://t.co/vVSELP7j"
"1590",2012-11-01 14:36:01,37.0902,-95.7129,"American Red Cross donations for Hurricane Sandy relief now being accepted through iTunes http://t.co/SqYYNaLk #Gadget #News"
"1591",2012-11-02 00:14:05,10000,10000,"American Red Cross Donations Being Accepted Through iTunes for Hurricane Sandy Relief: It<U+0092>s been a h... http://t.co/Dz0fEV3X #tech #news"
"1592",2012-11-06 10:32:14,43.0508,-76.1474,"American Red Cross calls for blood donations in Hurricane Sandy's wake http://t.co/VkYmXusm"
"1593",2012-11-02 16:47:51,10000,10000,"All You Need to Know to Help Out Hurricane Sandy Victims http://t.co/UNT0cNaz"
"1594",2012-11-01 16:03:13,10000,10000,"All you kind peeps..\Please send a dollar or 2 to the Red Cross in New Jersey. Help our Jersey neighbors who fell victim to Hurricane Sandy"
"1595",2012-11-01 16:00:48,40.6901,-73.8566,"All Nations is taking up a collection for Hurricane Sandy relief.  Please bring and clothing & non-perisihable food."
"1596",2012-11-01 20:41:18,10000,10000,"All my followers follow @help_si and donate to the families that were affected by hurricane sandy.. Lets help each other out xoxo"
"1597",2012-11-02 03:32:40,41.2035,-77.2679,"@alexmorgan13 Can i get a RT?  all proceeds go to Hurricane Sandy Relief Charity Shirt http://t.co/gz14Isxd"
"1598",2012-11-03 01:09:55,10000,10000,"Airlines reward customers who donate to Hurricane Sandy relief - Los Angeles Times: Airlines reward customers wh... http://t.co/x68iIGYF"
"1599",2012-11-06 00:25:07,10000,10000,"Adam Levine Urges El Lay To Donate To Hurricane Sandy Relief!: Such a nice way to take advantage of fame!\While ... http://t.co/Q22awNnJ"
"1600",2012-10-30 22:29:58,10000,10000,"Actress Denise Richards has urged fans to donate to the American Red Cross in the wake of Hurricane Sandy after ... http://t.co/tT8QoTE3"
"1601",2012-11-07 21:16:08,34.0489,-111.094,"A chance to help... RT Help the Red Cross aid those affected by the hurricane by donating to the SXSW Sandy Relief Fund http://t.co/lMRlXzV5"
"1602",2012-11-02 15:52:13,10000,10000,"About 44,000 blood donations are needed each day and even more now because of Hurricane Sandy. Find out how you can help on NCC News #B6641"
"1603",2012-10-31 22:41:34,10000,10000,"ABC online has TONS of links to help Hurricane Sandy victims: http://t.co/BAmuyvAw"
"1604",2012-11-02 23:21:47,40.0583,-74.4057,"@AARTevents is having a donation drive at @TheElanCatering in Lodi, NJ for hurricane victims. Sat 10am-4pm, Sun 10am-2pm Please help!"
"1605",2012-11-04 06:55:05,10000,10000,"A&#39;s accepting donations for hurricane relief http://t.co/wOIplu8U"
"1606",2012-11-05 18:54:44,40.7561,-73.987,"8 Ways to Help Hurricane Sandy Victims Beyond Donating to the Red Cross http://t.co/zZaXuRsM via @The_Stir @KiriBlakeley"
"1607",2012-11-05 15:49:52,10000,10000,"6 Ways To Help Out With Hurricane Sandy Relief  http://t.co/I1ZkaW07 via @refinery29"
"1608",2012-11-02 18:58:41,10000,10000,"6 Ways for Geeks to Help With Hurricane Sandy Relief: Here are a few programs that let you help with hurricane r... http://t.co/vThbdF9M"
"1609",2012-11-06 04:08:28,10000,10000,"6 T-Shirts You Can Buy Right Now to Benefit Hurricane Sandy Relief Efforts http://t.co/dOqsJSif"
"1610",2012-11-02 17:20:29,40.0182,-75.1257,".@6abc and @CBSPhilly, can you help spread the word? We're in need of taxis for hurricane victims at 1221 Old Freehold Rd. in Toms River, NJ"
"1611",2012-11-04 20:33:43,10000,10000,"5x7 Original painting $25 for Hurricane Relief Fund http://t.co/MFk9srjq"
"1612",2012-11-01 13:00:24,10000,10000,"5 Ways to Help Hurricane Sandy Victims in NYC http://t.co/TReCS1Tw"
"1613",2012-11-02 19:13:35,10000,10000,"4 Ways You Can Help with Hurricane Sandy Relief. Do you know other ways? Please share. http://t.co/LmHrjOwj"
"1614",2012-11-03 19:47:56,40.7561,-73.987,"35% OFF All orders Code: GIVEBACK| All proceeds this wknd go towards Hurricane Sandy Relief! http://t.co/0LcV26at"
"1615",2012-11-06 20:21:49,10000,10000,"@30STMVOTE damn! Wrong link! Honor Jared Leto's Birthday by helping with the Hurricane Sandy Relief & Clean Up http://t.co/So3K5DRu"
"1616",2012-11-02 00:28:00,33.5189,-86.8161,"20% of ALL purchases will be donated to those affected by Hurricane Sandy as part of Designer Drawer's Brief Relief. @colbymelvin"
"1617",2012-11-04 17:36:01,43.1939,-71.5724,"@20Hojo HOJO.. will you RT this great company and their shirt for Hurricane Sandy Relief ? Great METS fans too http://t.co/aSL3toq3"
"1618",2012-11-01 17:45:17,30.5195,-90.157,"1 Taking donations for clothing, blankets, pillows, and jackets for Hurricane Sandy victims in NJ.  DM me for drop off location"
"1619",2012-10-31 18:03:42,33.9977,-118.152,"$1 drop-off #papershredding until 11/9. Every box of paper you dispose safely will help victims of hurricane #sandy.   http://t.co/0Tm5l8ht"
"1620",2012-11-03 00:47:36,37.0902,-95.7129,"1-800-HELP-NOW\Donate to the Red Cross to help hurricane Sandy victims."
"1621",2012-11-03 23:42:41,33.3501,-111.756,"12 Ways to Help Hurricane Sandy Relief Efforts (Tree Hugger Site) http://t.co/HRUQaZ3Y"
"1622",2012-11-04 01:27:34,38.9108,-75.5277,"12 Ways to Help Hurricane Sandy Relief Efforts : TreeHugger http://t.co/5ROjbR7Y via @TreeHugger #superstormsandy #aftersandy"
"1623",2012-11-03 11:10:04,52.1326,5.29127,"12 Ways to Help Hurricane Sandy Relief Efforts http://t.co/tVgg5GMO #Living #sustainable #stagroup"
"1624",2012-11-03 11:09:19,-22.9035,-43.2096,"12 Ways to Help Hurricane Sandy Relief Efforts: \How to volunteer, where to donate, and more handy post-Hurrican... http://t.co/iSlHZaZR"
"1625",2012-11-04 18:07:49,40.7561,-73.987,"10 Ways To Not Waste This Weekend, If You Want To Help Hurricane Victims http://t.co/hBCOoMMf w/relief address for Breezy Point/Far Rockaway"
"1626",2012-11-04 16:22:18,40.7561,-73.987,"? 10% of sales from today through 9th will be donated to Hurricane Sandy Relief here in NY ? SSPS\http://t.co/cfLPUX18"
"1627",2012-11-03 00:18:15,10000,10000,"10% of our #tech support proceeds will go to Hurricane #Sandy relief efforts until the end of 2012."
"1628",2012-10-31 21:05:50,41.4997,-81.6937,"25% of all our sales this week will go directly 2 the Red Cross 2 help victims of Hurricane Sandy. http://t.co/OO8DJDyi http://t.co/oD9tQO7T"
"1629",2012-11-04 20:55:58,10000,10000,"ABA Sports announces a 'Kick-for-a-Cause' Hurricane Sandy Relief Kickball Tournament on Sunday, November 25th!... http://t.co/NWdEZYRN"
"1630",2012-11-02 05:14:53,37.6513,-91.8612,"<U+0093>@abrowniiee_x0: I really want to do something to help those affected by the hurricane on the east coast<U+0094> send a boat"
"1631",2012-10-30 16:24:34,10000,10000,"@AllHands is an amazing organization and I really want to raise money for hurricane Sandy relief. Donate today! https://t.co/3MQp74W1"
"1632",2012-11-02 21:28:56,39.2943,-76.6143,"All money from gate admissions this weekend will be donated to American Red Cross for Hurricane Sandy relief. Please come out and support"
"1633",2012-11-01 14:02:04,10000,10000,"Also Snooki is cleaning her closet out to donate to Hurricane victims. Kind of her, But I am not sure that kids want to wear her clothes?"
"1634",2012-11-02 00:38:39,10000,10000,"anybody know any places where i can volunteer for hurricane sandy where you dont have to be 18? i want to help out!"
"1635",2012-11-03 03:29:26,40.6752,-73.971,"Anyone got any clothes that want to donate to a friend of mines that lost everything in the hurricane please let me know. @NewYorkPost"
"1636",2012-11-02 18:48:06,10000,10000,"Anyone know where to donate blood/time to help with the Hurricane Sandy relief efforts? I'm looking to help but don't know where to go..."
"1637",2012-11-03 00:36:13,10000,10000,"Anyone know where you can drop off clothes to donate for Hurricane Sandy victims?"
"1638",2012-11-03 17:33:54,40.7264,-73.9899,"Anyone with connections to Hurricane Sandy relief efforts in NYC know how/where to sign up? I haven't heard back from redcross or nyccares"
"1639",2012-10-31 22:39:53,10000,10000,"Are they still collecting clothes at Intermediate Souuth to donate to the victims of Hurricane Sandy??"
"1640",2012-11-02 15:26:16,10000,10000,"Bon Jovi, Springsteen To Support Hurricane Sandy Victims http://t.co/Rpw0civq"
"1641",2012-11-01 22:12:22,55.7558,37.6176,"Bruce #Springsteen and Jon #BonJovi are to perform at a benefit concert for victims of Hurricane #Sandy on Friday\http://t.co/KHx95541"
"1642",2012-11-02 01:41:50,42.3584,-71.0598,"Buckyballs ceasing production due to CPSC pressure; donating 20% of profits to Red Cross hurricane relief: https://t.co/wTJR7Gnm"
"1643",2012-10-31 16:24:12,38.8921,-77.0241,"@chefjoseandres Since you've done amazing work in Haiti can you please recommend an org that I can direct donations to for hurricane relief?"
"1644",2012-11-02 23:45:12,40.6409,-74.8813,"Christie administration announces pet rescue hotline for Hurricane Sandy victims http://t.co/RAAvbC5S via @MyCentralJersey"
"1645",2012-11-01 14:32:24,47.6535,-117.411,"Concert tomorrow night to benefit the Red Cross for hurricane sandy. Based on who they announced performing this concerts from the 80's"
"1646",2012-10-31 03:41:37,10000,10000,"Continued Prayers for all who are suffering the effects of Hurricane Sandy.  Making a Donation to:  http://t.co/WqNENclT #REDCROSS #SANDY"
"1647",2012-10-31 01:36:27,10000,10000,"Deadass I wanna help with the hurricane clean up, I feel the need to help out and get some work done"
"1648",2012-11-01 21:08:08,35.2314,-80.8458,"Disney/ABC Television Group Announces <U+FF93>Day Of Giving<U+FF94> For Hurricane Sandy Victims http://t.co/h8a9I1xF [via http://t.co/jU1iglZb]"
"1649",2012-11-02 20:57:38,40.7561,-73.987,"Disney/ABC to Host 'Day of Giving,' to Help Those Affected by Hurricane Sandy... \http://t.co/tHMsQeWN"
"1650",2012-11-02 12:05:52,35.7596,-79.0193,"Disney will donate $2 million and Viacom will give $1 million to the Hurricane #Sandy rebuilding effort http://t.co/DVyDsv9j"
"1651",2012-11-02 13:52:13,39.0458,-76.6413,"DoD, National Guard continue to help out w/ Hurricane Sandy recovery http://t.co/aMtSuYih"
"1652",2012-11-01 16:00:10,40.7561,-73.987,"Does anyone in Brooklyn/NYC with a car want to volunteer with hurricane relief efforts? I want to help but have no way of getting anywhere."
"1653",2012-11-02 14:09:12,10000,10000,"Does anyone know anyways to volunteer / help hurricane sandy victims. #replytweet"
"1654",2012-11-06 00:00:20,10000,10000,"Does anyone know how to donate clothes to hurricane #Sandy victims ?? @RedCross #RedCross"
"1655",2012-11-01 20:57:48,40.7561,-73.987,"Does anyone know if clothing is needed for hurricane relief in NYC? If so, where?"
"1656",2012-11-02 15:00:09,39.3961,-76.6195,"does anyone know if there a local drop-off center in frederick to donate clothes to victims of hurricane sandy??"
"1657",2012-11-02 22:30:43,10000,10000,"Does anyone know if there's any way to send clothes to Hurricane Sandy victims from here?"
"1658",2012-11-05 12:57:51,10000,10000,"Does anyone know of any charities that are taking children's clothing donations for Hurricane Sandy victims?  The... http://t.co/MMm1vdiw"
"1659",2012-11-02 22:25:32,10000,10000,"Does anyone know of any community service organizations to help out the Hurricane Sandy victims? #replytweet"
"1660",2012-11-06 03:03:24,-4.41667,32.6667,"Does anyone know of a place in Delaware that is accepting donations for Hurricane Sandy victims?  I'm looking,... http://t.co/6lpV9Q2K"
"1661",2012-11-02 15:38:24,10000,10000,"Does anyone know of local shelters or places collecting clothes for hurricane victims?"
"1662",2012-11-04 20:37:59,40.7144,-74.006,"Does anyone know where we can donate clothes to hurricane victims in New Jersey? #hurricanesandy #newjersey #donate #rebuild"
"1663",2012-11-02 23:29:35,40.7561,-73.987,"Donating 10% of each sale to the American Red Cross on relief for those directly hit by Hurricane Sandy #hurricanesandy"
"1664",2012-11-05 13:16:38,39.2943,-76.6143,"Donating to Red Cross on payday, its the least I can do. The hurricane really fucked up ppl's homes"
"1665",2012-10-31 15:42:17,10000,10000,"Fannie and Freddie To Offer Relief To Hurricane Sandy Victims... http://t.co/lQrVekls"
"1666",2012-11-02 17:18:20,42.3399,-71.0899,"Former XK guests Ming Tsai, Tony Maws, and Joanne Chang to Raise Funds for Hurricane Relief http://t.co/p4DLIqv3"
"1667",2012-11-03 03:20:35,39.767,-86.1563,"Friend trying to Help Hurricane Victim(s) Reaching out 2 help 1-2 individuals in need.  See public FB profile http:/facebook.com/ctfuqua"
"1668",2012-11-02 18:11:43,34.0489,-111.094,"FYI: On Monday, The View will participate in ABC<U+FF92>s Day of Giving to help those affected by Hurricane# Sandy.... http://t.co/hUQiJuLf"
"1669",2012-11-03 12:17:10,40.7561,-73.987,"Generators & Food will be donated to the Hurricane Sandy victims from the canceled ING New York City Marathon!... http://t.co/plBxgY7N"
"1670",2012-11-02 00:44:17,40.7561,-73.987,"Getting together clothing and food to donate to hurricane victims on Long Island.  Every little bit helps!"
"1671",2012-11-02 13:35:05,10000,10000,"Goin To Help The Hurricane Victims http://t.co/6WqSnl0M"
"1672",2012-10-28 06:42:16,10000,10000,"Gulf Power Crews Heading North To Help After Hurricane Sandy: A convoy of Gulf Power Company crews will travel n... http://t.co/BQI9lYdE"
"1673",2012-11-04 15:04:11,40.7561,-73.987,"Heading to the #Rockaways to help with hurricane #Sandy relief efforts. http://t.co/EXHmLnMD"
"1674",2012-11-02 17:49:19,10000,10000,"Hey, I'm in! @HeadCounOrg Participation Party in NYC Monday - a BENEFIT FOR VICTIMS OF HURRICANE SANDY, with all proceeds to the Red Cross."
"1675",2012-11-01 19:19:31,30.3753,69.3451,"#hollywood #news Christina Aguilera, Bruce Springsteen & More To Perform Benefit Concert For Hurricane Sandy Victims http://t.co/Gzl9flCl"
"1676",2012-11-05 22:56:08,26.1372,-80.1287,"Honda Media Newsroom - Headlines - Honda Pledges $500,000 to Red Cross for Hurricane Sandy Relief http://t.co/FUjuZ3Fz"
"1677",2012-11-02 23:06:12,41.6529,-83.5778,"Hopefully at my unit this weekend they tell me I get to go help the victims of hurricane Sandy."
"1678",2012-11-05 02:24:21,-78.6569,37.4316,"Hoping to go to New Jersey soon for Hurricane Sandy victims.. I just want to help"
"1679",2012-11-03 13:56:13,33.7545,-84.3897,"How to Help RT @WSJ: Want to help the victims of Hurricane #Sandy? Volunteer efforts, donations sites: http://t.co/NsY6H76U"
"1680",2012-11-05 18:59:29,39.2943,-76.6143,"http://t.co/4myGlAww Small Business Administration Stands Ready to Help After Hurricane Sandy: \Were you affected by Hur...  Gary Rothfeld"
"1681",2012-11-05 16:07:32,-14.235,-51.9253,"http://t.co/sL7sHaOC: Hurricane Sandy Relief - johnmayer: This week, we will be donating clothing, blankets, and... http://t.co/rU1wcjqF"
"1682",2012-10-30 15:59:20,37.7752,-122.419,"Hurricane and Halloween?  Kids and I would like to help kids in Hurricane path still have a Halloween.  What can we do?  Can organize/help."
"1683",2012-10-28 05:21:27,10000,10000,"Hurricane Sandy at UDC: visit http://t.co/KniuBwWB for links on hurricane preparedness, storm tracking and how to... http://t.co/Fl0RA6Lb"
"1684",2012-11-05 20:00:17,10000,10000,"Hurricane Sandy Relief Shirts - All proceeds will be donated to the American Red Cross http://t.co/mfR1jfE9 #edm #sandy http://t.co/zX6icceG"
"1685",2012-11-02 02:52:31,10000,10000,"I am about to text the number to donate money for the Hurricane Sandy Relief Foundation just because Vinny i http://t.co/70h8e2C0"
"1686",2012-10-30 16:43:27,24.561,-81.7789,"I am taking today to remember and support those impacted by Hurricane Sandy by making a donation to the Red Cross... http://t.co/GhIDssfY"
"1687",2012-11-06 03:32:34,53.9333,-116.577,"@iansomerhalder watching your live talks got me inspired i decided to make a donation to help out the people in need due to hurricane sandy!"
"1688",2012-11-03 22:46:28,10000,10000,"I'd happily volunteer to go and help Hurricane Sandy victims #Truth"
"1689",2012-11-02 06:26:18,10000,10000,"if anyone knows about volunteer efforts for the current hurricane relief, please let me know.. I want to help #hurricanesandy"
"1690",2012-11-03 22:42:22,40.6752,-73.971,"If I win the Powerball tonight, I pledge to donate $5 million to Hurricane Sandy relief. First thing I do."
"1691",2012-11-01 19:13:30,41.6945,-73.9221,"If your school needs hurricane Sandy relief please http://t.co/4yRZ53xs @TeacherCast"
"1692",2012-11-02 19:45:05,27.7131,-82.3457,"I got a bunch of clothes I'd like to donate to hurricane sandy victims. Anyone know where/how I can do that?"
"1693",2012-11-05 03:01:58,39.9516,-75.1638,"I have clothes that I'd like to donate to Hurricane Sandy victims, anyone know of drop off places for me to take them to in Jersey/NY?"
"1694",2012-11-03 00:25:46,37.5408,-77.4339,"I have to donate to hurricane sandy"
